== worker1 ==
-- @service: worker1 worker2 worker3
-- Step 1d. Switch each subscription to its own filtered publication.
SELECT format('ALTER SUBSCRIPTION sub_ref_w%1$s SET PUBLICATION ref_w%1$s WITH (refresh = false)', :worker_id) \gexec
ALTER SUBSCRIPTION sub_ref_w1 SET PUBLICATION ref_w1 WITH (refresh = false)
ALTER SUBSCRIPTION
SELECT subname, subpublications FROM pg_subscription;
  subname   | subpublications 
------------+-----------------
 sub_ref_w1 | {ref_w1}
(1 row)

-- Changing the publication is not retroactive: what was already copied stays.
SELECT count(*) AS customers_still_there, count(billing_notes) AS notes_still_there FROM customers;
 customers_still_there | notes_still_there 
-----------------------+-------------------
                     9 |                 9
(1 row)

-- Cleanup is our job (local writes to a subscribed table are allowed; the column is
-- not in the column list any more, so the apply worker will never write it).
DELETE FROM customers WHERE worker_id <> :worker_id;
DELETE 6
ALTER TABLE customers DROP COLUMN billing_notes;
ALTER TABLE
SELECT customer_id, name, worker_id, plan_id FROM customers ORDER BY 1;
 customer_id |    name    | worker_id | plan_id 
-------------+------------+-----------+---------
           1 | customer-1 |         1 |       1
           2 | customer-2 |         1 |       2
           3 | customer-3 |         1 |       3
(3 rows)

== worker2 ==
-- @service: worker1 worker2 worker3
-- Step 1d. Switch each subscription to its own filtered publication.
SELECT format('ALTER SUBSCRIPTION sub_ref_w%1$s SET PUBLICATION ref_w%1$s WITH (refresh = false)', :worker_id) \gexec
ALTER SUBSCRIPTION sub_ref_w2 SET PUBLICATION ref_w2 WITH (refresh = false)
ALTER SUBSCRIPTION
SELECT subname, subpublications FROM pg_subscription;
  subname   | subpublications 
------------+-----------------
 sub_ref_w2 | {ref_w2}
(1 row)

-- Changing the publication is not retroactive: what was already copied stays.
SELECT count(*) AS customers_still_there, count(billing_notes) AS notes_still_there FROM customers;
 customers_still_there | notes_still_there 
-----------------------+-------------------
                     9 |                 9
(1 row)

-- Cleanup is our job (local writes to a subscribed table are allowed; the column is
-- not in the column list any more, so the apply worker will never write it).
DELETE FROM customers WHERE worker_id <> :worker_id;
DELETE 6
ALTER TABLE customers DROP COLUMN billing_notes;
ALTER TABLE
SELECT customer_id, name, worker_id, plan_id FROM customers ORDER BY 1;
 customer_id |    name    | worker_id | plan_id 
-------------+------------+-----------+---------
           4 | customer-4 |         2 |       1
           5 | customer-5 |         2 |       2
           6 | customer-6 |         2 |       3
(3 rows)

== worker3 ==
-- @service: worker1 worker2 worker3
-- Step 1d. Switch each subscription to its own filtered publication.
SELECT format('ALTER SUBSCRIPTION sub_ref_w%1$s SET PUBLICATION ref_w%1$s WITH (refresh = false)', :worker_id) \gexec
ALTER SUBSCRIPTION sub_ref_w3 SET PUBLICATION ref_w3 WITH (refresh = false)
ALTER SUBSCRIPTION
SELECT subname, subpublications FROM pg_subscription;
  subname   | subpublications 
------------+-----------------
 sub_ref_w3 | {ref_w3}
(1 row)

-- Changing the publication is not retroactive: what was already copied stays.
SELECT count(*) AS customers_still_there, count(billing_notes) AS notes_still_there FROM customers;
 customers_still_there | notes_still_there 
-----------------------+-------------------
                     9 |                 9
(1 row)

-- Cleanup is our job (local writes to a subscribed table are allowed; the column is
-- not in the column list any more, so the apply worker will never write it).
DELETE FROM customers WHERE worker_id <> :worker_id;
DELETE 6
ALTER TABLE customers DROP COLUMN billing_notes;
ALTER TABLE
SELECT customer_id, name, worker_id, plan_id FROM customers ORDER BY 1;
 customer_id |    name    | worker_id | plan_id 
-------------+------------+-----------+---------
           7 | customer-7 |         3 |       1
           8 | customer-8 |         3 |       2
           9 | customer-9 |         3 |       3
(3 rows)

